{"probe_choice":"P2","expected_observation":"The held-out tenant-class workload will reveal whether p99 is below 250 ms for every class; based on the mean-only evidence, I predict it will not satisfy the objective for all classes.","probability":0.35,"decision_relevance":"Directly measures the customer’s promotion criterion and can expose tenant-specific tail-latency regressions that the mean benchmark hides."}