{"probe_choice":"P1","expected_observation":"The v4-to-v5 scheduler diff will show a retry-boundary change from attempt < limit in v4 to attempt <= limit in v5, supporting version-specific behavior.","probability":0.9,"decision_relevance":"High: directly tests the implementation difference distinguishing M2 from the uniform-inclusive and nondeterministic models."}