{"probe_choice":"P2","expected_observation":"Held-out p99 measurements by tenant class will reveal whether every class is below 250 ms; the mean improvement alone provides weak evidence, so I predict a 35% probability that all classes satisfy the objective.","probability":0.35,"decision_relevance":"Directly tests the customer promotion gate and can block promotion if any tenant class exceeds the p99 limit."}