{"probe_choice":"P1","expected_observation":"Succeed with probability 0.67; failure would support M2, while success would largely rule out M2 and favor M1 or M3.","probability":0.67,"decision_relevance":"P1 isolates stale cache by holding the header name and value at known-good settings while changing only tenant age."}