{"probe_choice":"P2","expected_observation":"Held-out p99 measurements by tenant class may show whether each class is below 250 ms; the mean improvement alone does not establish this, so at least one class may still exceed the objective.","probability":0.2,"decision_relevance":"Directly measures the customer’s promotion criterion and supports a per-tenant-class promotion decision."}