{"probe_choice":"P1","expected_observation":"The scheduler diff will show a version-specific boundary condition: v4 uses attempt < limit, while v5 uses attempt <= limit, supporting M2.","probability":0.9,"decision_relevance":"This directly tests the causal mechanism behind the conflicting boundary observations and determines whether to preserve a version-specific retry rule rather than the stale all-inclusive rule."}