{"probe_choice":"P1","expected_observation":"The v4-to-v5 scheduler diff shows a change from an exclusive retry boundary (attempt < limit) in v4 to an inclusive boundary (attempt <= limit) in v5, supporting version-specific behavior.","probability":0.85,"decision_relevance":"Directly tests whether the observed boundary difference is implemented behavior, distinguishing M2 from M1 and M3."}